name^	description	symbol	color	baseWeapon:RawWeapon	"weapons:RawWeapon[,]"	precision:d	damage:d	crit:d	influence:d	evasion:d	defense:d	luck:d	stealth:d	range:d	area:d	quickness:d	vigor:d	endurance:d	spirit:d	sanity:d	total:i	training:s{ }i	"culture:s[,]"
goblin nincompoop	"The laughingstock of other goblins, who themselves are the laughingstock of everyone else."	ģ/	CW Drab Chartreuse	Mobyuld style	"carving knife,sickle,sling"	2	1	3	4	3	1	2	6	0	0	6	1	1	1	5	36	hunter 1 swordsman 1	Mobyuld
goblin delinquent	"The toughest goblin... of a group of the weakest goblins. Possibly a threat, maybe? To a toy poodle?"	ɠ*	CW Flush Chartreuse	Mobyuld style	"section staff,meteor flail,staff sling"	3	2	3	4	3	2	2	5	0	0	5	2	2	1	5	39	jester 1 brawler 2	Mobyuld
hobgoblin grunt	"Bigger than the average human, but a little lacking in the creative thinking department. Seems to like taking orders."	ġ	CW Faded Lime	Mobyuld style	"khopesh,heavy shield,hammer"	5	6	2	1	2	4	0	6	0	0	4	5	5	1	6	47	brute 2 guardian 1	Mobyuld
hobgoblin captain	"The boss around here, or so he says. Bigger than other hobgoblins, which is probably why they listen to him."	ǧ*	CW Drab Lime	Mobyuld style	"light crossbow,musket,katana"	6	7	4	2	0	5	0	4	0	0	3	8	6	2	6	53	marksman 2 duelist 2	Mobyuld
Hell lion	"Like a lion... from Hell. Big pointy teeth, serious claws, and fire magic."	L*	Coral Red	fire magic	"raking claws,mauling bite"	3	9	3	2	2	6	0	0	0	0	5	20	7	6	7	70	sorcerer 3 hunter 4	Beast
squishy	A mobile slime mold the size of a small dog.	s		pseudopod	hardened pseudopod	7	1	1	1	6	7	1	3	0	0	9	2	3	2	5	48	scavenger 3	Geller
bull squishy	A large squishy with a wild tangle of hardened bits that act as antlers for fighting.	s		hardened pseudopod	antlers	5	8	7	6	7	15	2	0	0	0	6	12	9	2	5	84	brute 4 guardian 2	Geller
farmer squishy	A very large squishy that actively seeks out organics to break down into food for its herd.	S		pseudopod net	hardened pseudopod	4	5	1	3	5	12	3	9	2	2	2	17	13	2	5	85	scavenger 5 hunter 2 farmer 2	Geller
squishy farmer	A human who specializes in raising and caring for squishy.	F		panic style	"net, shovel"	1	2	1	7	1	3	0	1	0	0	3	4	3	2	8	36	farmer 3 guardian 1	Human
